{
  "claimVersion":"0.15","subject":"com.example.echo@0.1.0","specVersion":"community-v0.15","hostDescriptorDigest":"sha256:cccccccccccccccccccccccccccccccccccccccccccccccccccccccccccccccc","artifactDigest":"sha256:aaaaaaaaaaaaaaaaaaaaaaaaaaaaaaaaaaaaaaaaaaaaaaaaaaaaaaaaaaaaaaaa","suiteVersion":"0.15.0-experimental","evidenceLevel":"Tested","result":"pass","testedAt":"2026-08-17T03:00:00Z","runtime":"node-24/linux-x64","revoked":false,"failedRequirements":[]
}
